{
  "receiptVersion": "1.0.0",
  "id": "v3-frostbound-reward-concept",
  "sourceType": "ai-generated",
  "generationId": "exec-8e9cd419-372e-4529-be1e-0593fa102be2",
  "generatedAt": "2026-07-17",
  "provider": "OpenAI image generation",
  "modelSettings": "tool-managed defaults; no explicit seed or model parameters exposed",
  "file": "v3-frostbound-reward-concept.png",
  "mediaType": "image/png",
  "width": 941,
  "height": 1672,
  "sha256": "19d55d8ed0d1a2b8949bcd135ecd95ad2d0b5920846a843b652949eb02712383",
  "targetLogicalCanvas": {
    "width": 540,
    "height": 960
  },
  "targetPresentationCanvas": {
    "width": 1080,
    "height": 1920
  },
  "usageBoundary": "Primary concept reference for analysis, annotation, comparison, and human review only. Never use its pixels as production component geometry, masks, materials, or final assets.",
  "rights": "Project-generated reference; project usage permitted.",
  "prompt": "Use case: ui-mockup\nAsset type: V3 portrait-mobile game UI concept reference\n\nPrimary request:\nCreate one polished 9:16 portrait mobile-game screen concept titled exactly ‘FROSTBOUND REWARD’. The screen establishes a coherent icy-fantasy direction and a bounded reconstruction target consisting of a Panel, Button family, and Progress component. It is a visual reference only, not a cut-apart asset sheet or final component source.\n\nScene and backdrop:\nA restrained dark arctic-blue game backdrop with subtle cold mist and faint snow motes. No characters, scenery narrative, products, logos, device frame, or background clutter.\n\nSubject and layout:\nCenter a large frosted-crystal reward popup with generous safe margins. Use a carved silver-blue frame, translucent icy inset surfaces, clean editable content slots, and a clear top-to-bottom hierarchy:\n1. Header labeled exactly ‘FROSTBOUND REWARD’.\n2. A prominent reward-content area with a simple abstract crystal reward emblem and open space around it.\n3. A horizontal progress component labeled exactly ‘75%’, with unmistakable filled versus unfilled states.\n4. A large dominant primary action button labeled exactly ‘CLAIM’.\n5. A smaller, quieter secondary action button labeled exactly ‘LATER’.\nInclude one clearly selected/active state within the popup using shape, luminous border, and value contrast—not text alone.\n\nStyle:\nHigh-quality stylized fantasy mobile-game UI concept; crystalline ice, frosted glass, carved metal, restrained snow grain, and subtle rune geometry. Practical, readable, and shippable-looking rather than painterly. Unified component family with reusable material language and bounded ornament. Avoid neon-market styling, sci-fi circuitry, photorealism, overly ornate filigree, and generic web-dashboard aesthetics.\n\nComposition and hierarchy:\nExact portrait 9:16 composition, conceptually suitable for 540×960 logical pixels / 1080×1920 presentation. Target-phone readability. The primary CLAIM button must be unmistakably more important than LATER through scale, placement, fill, glow, and contrast. Component silhouettes must remain clearly separable while belonging to the same family.\n\nLighting and palette:\nCool overhead lighting, cyan-white crystalline edge glints, deep navy shadows, ice blue and white surfaces, with at most a tiny restrained violet accent. Strong legibility and accessible contrast.\n\nMaterials:\nFrost/crystal surface language should suggest reusable normalized material inputs: subtle tileable-looking frost grain, consistent bevels, repeatable highlights, and independent glow/shadow effects. Do not imply unique baked full-component textures.\n\nText constraints:\nRender only these exact text strings and no others:\n‘FROSTBOUND REWARD’\n‘75%’\n‘CLAIM’\n‘LATER’\nKeep all text crisp, correctly spelled, horizontal, and readable.\n\nHard constraints:\nSingle screen only. No watermark, signature, brand mark, trademark, character, device mockup, Unity editor chrome, cut lines, exploded parts, multiple variants, asset-sheet layout, or explanatory annotations. Preserve editable-looking geometry and empty content space."
}
